[
  {
    "vendorId": "orchestral-tools",
    "libraryId": "berlin-strings-first-chairs",
    "instrumentId": "celli-leader",
    "articulations": [
      { "articulationId": "legato", "variantIds": [] },
      { "articulationId": "pizzicato", "variantIds": [] },
      { "articulationId": "portato", "variantIds": ["long", "short"] },
      { "articulationId": "spiccato", "variantIds": [] },
      { "articulationId": "staccato", "variantIds": [] },
      { "articulationId": "sustains", "variantIds": ["acc", "soft"] },
      { "articulationId": "tremolo", "variantIds": [] },
      { "articulationId": "trills", "variantIds": [] }
    ]
  },
  {
    "vendorId": "orchestral-tools",
    "libraryId": "berlin-strings-first-chairs",
    "instrumentId": "basses-leader",
    "articulations": [
      { "articulationId": "legato", "variantIds": [] },
      { "articulationId": "pizzicato", "variantIds": [] },
      { "articulationId": "portato", "variantIds": ["long", "short"] },
      { "articulationId": "spiccato", "variantIds": [] },
      { "articulationId": "staccato", "variantIds": [] },
      { "articulationId": "sustains", "variantIds": ["acc", "soft"] },
      { "articulationId": "tremolo", "variantIds": [] },
      { "articulationId": "trills", "variantIds": [] }
    ]
  },
  {
    "vendorId": "orchestral-tools",
    "libraryId": "berlin-strings-first-chairs",
    "instrumentId": "violas-leader",
    "articulations": [
      { "articulationId": "legato", "variantIds": [] },
      { "articulationId": "pizzicato", "variantIds": [] },
      { "articulationId": "portato", "variantIds": ["long", "short"] },
      { "articulationId": "spiccato", "variantIds": [] },
      { "articulationId": "staccato", "variantIds": [] },
      { "articulationId": "sustains", "variantIds": ["acc", "soft"] },
      { "articulationId": "tremolo", "variantIds": [] },
      { "articulationId": "trills", "variantIds": [] }
    ]
  },
  {
    "vendorId": "orchestral-tools",
    "libraryId": "berlin-strings-first-chairs",
    "instrumentId": "violins-i-leader",
    "articulations": [
      { "articulationId": "legato", "variantIds": [] },
      { "articulationId": "pizzicato", "variantIds": [] },
      { "articulationId": "portato", "variantIds": ["long", "short"] },
      { "articulationId": "spiccato", "variantIds": [] },
      { "articulationId": "staccato", "variantIds": [] },
      { "articulationId": "sustains", "variantIds": ["acc", "soft"] },
      { "articulationId": "tremolo", "variantIds": [] },
      { "articulationId": "trills", "variantIds": [] }
    ]
  },
  {
    "vendorId": "orchestral-tools",
    "libraryId": "berlin-strings-first-chairs",
    "instrumentId": "violins-ii-leader",
    "articulations": [
      { "articulationId": "legato", "variantIds": [] },
      { "articulationId": "pizzicato", "variantIds": [] },
      { "articulationId": "portato", "variantIds": ["long", "short"] },
      { "articulationId": "spiccato", "variantIds": [] },
      { "articulationId": "staccato", "variantIds": [] },
      { "articulationId": "sustains", "variantIds": ["acc", "soft"] },
      { "articulationId": "tremolo", "variantIds": [] },
      { "articulationId": "trills", "variantIds": [] }
    ]
  }
]
