[
  {
    "vendorId": "soundpaint",
    "libraryId": "2001-piccolo-shire",
    "instrumentId": "piccolo",
    "articulations": [
      { "articulationId": "arc", "variantIds": [] },
      { "articulationId": "legato", "variantIds": ["combo", "lyrical", "strong"] },
      { "articulationId": "marcato", "variantIds": [] },
      { "articulationId": "runs", "variantIds": [] },
      { "articulationId": "trills", "variantIds": ["major-2nd", "minor-2nd"] },
      { "articulationId": "sustains", "variantIds": [] },
      { "articulationId": "staccatissimo", "variantIds": [] }
    ]
  }
]
