[
  {
    "vendorId": "samplemodeling",
    "libraryId": "french-horn-tuba",
    "instrumentId": "horn",
    "articulations": [
      { "articulationId": "performance", "variantIds": [] }
    ]
  },
  {
    "vendorId": "samplemodeling",
    "libraryId": "french-horn-tuba",
    "instrumentId": "tuba",
    "articulations": [
      { "articulationId": "performance", "variantIds": [] }
    ]
  }
]
