[
  {
    "vendorId": "vienna-symphonic-library",
    "libraryId": "synchron-prime-strings-1",
    "instrumentId": "basses",
    "articulations": [
      {
        "articulationId": "long",
        "variantIds": []
      },
      {
        "articulationId": "universal",
        "variantIds": []
      },
      {
        "articulationId": "pizzicato",
        "variantIds": []
      },
      {
        "articulationId": "staccato",
        "variantIds": []
      },
      {
        "articulationId": "tremolo",
        "variantIds": []
      }
    ]
  },
  {
    "vendorId": "vienna-symphonic-library",
    "libraryId": "synchron-prime-strings-1",
    "instrumentId": "celli",
    "articulations": [
      {
        "articulationId": "long",
        "variantIds": []
      },
      {
        "articulationId": "universal",
        "variantIds": []
      },
      {
        "articulationId": "pizzicato",
        "variantIds": []
      },
      {
        "articulationId": "staccato",
        "variantIds": []
      },
      {
        "articulationId": "tremolo",
        "variantIds": []
      }
    ]
  },
  {
    "vendorId": "vienna-symphonic-library",
    "libraryId": "synchron-prime-strings-1",
    "instrumentId": "strings-ensemble",
    "articulations": [
      {
        "articulationId": "long",
        "variantIds": []
      },
      {
        "articulationId": "universal",
        "variantIds": []
      },
      {
        "articulationId": "pizzicato",
        "variantIds": []
      },
      {
        "articulationId": "staccato",
        "variantIds": []
      },
      {
        "articulationId": "tremolo",
        "variantIds": []
      }
    ]
  },
  {
    "vendorId": "vienna-symphonic-library",
    "libraryId": "synchron-prime-strings-1",
    "instrumentId": "violas",
    "articulations": [
      {
        "articulationId": "long",
        "variantIds": []
      },
      {
        "articulationId": "universal",
        "variantIds": []
      },
      {
        "articulationId": "pizzicato",
        "variantIds": []
      },
      {
        "articulationId": "staccato",
        "variantIds": []
      },
      {
        "articulationId": "tremolo",
        "variantIds": []
      }
    ]
  },
  {
    "vendorId": "vienna-symphonic-library",
    "libraryId": "synchron-prime-strings-1",
    "instrumentId": "violins-i",
    "articulations": [
      {
        "articulationId": "long",
        "variantIds": []
      },
      {
        "articulationId": "universal",
        "variantIds": []
      },
      {
        "articulationId": "pizzicato",
        "variantIds": []
      },
      {
        "articulationId": "staccato",
        "variantIds": []
      },
      {
        "articulationId": "tremolo",
        "variantIds": []
      }
    ]
  },
  {
    "vendorId": "vienna-symphonic-library",
    "libraryId": "synchron-prime-strings-1",
    "instrumentId": "violins-ii",
    "articulations": [
      {
        "articulationId": "long",
        "variantIds": []
      },
      {
        "articulationId": "universal",
        "variantIds": []
      },
      {
        "articulationId": "pizzicato",
        "variantIds": []
      },
      {
        "articulationId": "staccato",
        "variantIds": []
      },
      {
        "articulationId": "tremolo",
        "variantIds": []
      }
    ]
  }
]
